chapter,verse,"text"
1,1,"Awor tabatin un sierto hòmber di Ramataim-zofim di e serunan di Efrain, i su nòmber tabata Elkana, yu hòmber di Jeroham, yu hòmber di Eliú, yu hòmber di Tohu, yu hòmber di Zuf, un efrateo."
1,2,"I e tabatin dos esposa: nòmber di esun tabata Ana i nòmber di e otro tabata Penina; i Penina tabatin yu, ma Ana no tabatin yu."
1,3,"Awor tur aña e hòmber aki tabata bai for di su stat pa adorá i pa ofresé sakrifisio na e SEÑOR di ehérsitonan na Silo. I e dos yu hòmbernan di Elí, Ofni i Finees, tabata saserdote di SEÑOR ayanan."
1,4,"I ora ku e dia pa Elkana ofresé sakrifisio a yega, e tabata duna su esposa Penina i tur su yu hòmbernan i su yu muhénan nan porshon,"
1,5,"ma Ana e tabata duna un porshon dòbel, pasobra e tabata stima Ana, ma SEÑOR a sera su matris."
1,6,"Su rival, sinembargo, tabata probok'é sin miserikòrdia pa hasié sinti su mes fastioso, pasobra SEÑOR a sera su matris."
1,7,"I a sosodé ku aña tras aña, kada bes ku e tabata bai na e kas di SEÑOR, Penina tabata probok'é, asina ku e tabata yora i no tabata kome."
1,8,"Anto su esposo Elkana a bis'é: \"Ana, pakiko bo ta yora i pakiko bo no ta kome i pakiko bo kurason ta tristu asina? Mi no ta nifiká mas pa bo ku dies yu hòmber?\""
1,9,"E ora ei Ana a lanta despues di a kome i bebe na Silo. Awor saserdote Elí tabata sintá riba e asiento banda di e kosein-di-porta di e tèmpel di SEÑOR."
1,10,"I Ana, ku amargura di alma, a hasi orashon na SEÑOR i a yora mashá."
1,11,"I el a hasi un huramentu i a bisa: \"O SEÑOR di ehérsitonan, si di bèrdat Bo mira e aflikshon di Bo sirbiente i kòrda riba mi i no lubidá riba Bo sirbiente, ma duna Bo sirbiente un yu hòmber, e ora ei lo mi dun'é na SEÑOR tur e dianan di su bida, i nunka nabaha lo no pasa riba su kabes.\""
1,12,"Awor a sosodé ku mientras e tabata sigui hasi orashon den e presensia di SEÑOR, Elí tabata opservá su boka."
1,13,"Ma Ana tabata papia den su kurason, solamente su lepnan tabata move, ma no por a tende su bos. Pesei Elí a pensa ku ta burachi e tabata."
1,14,"E ora ei Elí a bis'é: \"Kuantu tempu mas lo bo sigui bebe burachi? Stòp di bebe biña.\""
1,15,"Ma Ana a kontestá i a bisa: \"Nò, mi señor, mi ta un muhé hopi tribulá. Mi no a bebe biña ni bibida stèrki, ma mi a drama mi alma dilanti di SEÑOR."
1,16,"No tuma bo sirbiente pa un muhé pèrvèrso, pasobra ta for di mi preokupashon grandi i for di mi aflikshon mi a papia te awor aki.\""
1,17,"Anto Elí a kontestá i a bisa: \"Bai na pas; i ku e Dios di Israel dunabo bo petishon ku bo a hasi na djE.\""
1,18,"I Ana a bisa: \"Laga bo sirbiente haña grasia den bo bista.\" Asina e muhé a kohe su kaminda bai i a kome, i su kara no tabata tristu mas."
1,19,"Anto nan a lanta mainta tempran i a adorá dilanti di SEÑOR, i a bolbe bai nan kas bèk na Rama. I Elkana tabatin relashon ku su esposa Ana, i SEÑOR a kòrda riba djé."
1,20,"I a sosodé ku na su debido tempu, despues ku Ana a konsebí, el a duna lus na un yu hòmber; i el a yam'é Samuel, bisando: \"Pasobra mi a pidié na SEÑOR.\""
1,21,"Anto e hòmber Elkana a bai ku tur e hendenan di su kas pa ofresé na SEÑOR e sakrifisio di tur aña i pa kumpli ku su huramentu."
1,22,"Ma Ana no a bai, pasobra el a bisa su esposo: \"Lo mi no bai te ora ku mi kita e yu for di pechu; e ora ei lo mi hib'é, pa e paresé dilanti di SEÑOR i keda ayanan pa semper.\""
1,23,"I su esposo Elkana a bis'é: \"Hasi loke ta parsebo mihó. Keda te ora bo a kit'é for di pechu; solamente, ku SEÑOR konfirmá Su palabra.\" Asina e muhé a keda i a kria su yu hòmber te ora ku el a kit'é for di pechu."
1,24,"Awor ora ku el a kit'é for di pechu, el a hib'é kuné, ku un toro di tres aña i un efa di hariña i un butishi di biña, i a hib'é na e kas di SEÑOR na Silo, ounke ku e mucha tabata chikitu."
1,25,"E ora ei nan a mata e toro i a hiba e mucha pa Elí."
1,26,"I Ana a bisa: \"O mi señor! Manera bo alma ta biba, mi señor, ta ami ta e muhé ku tabata pará aki banda di bo ta hasi orashon na SEÑOR."
1,27,"Pa e mucha aki mi a hasi orashon, i SEÑOR a dunami mi petishon ku mi a hasi na djE."
1,28,"Pesei tambe mi a dedik'é na SEÑOR; tanten ku e ta na bida e ta dediká na SEÑOR.\" I el a adorá SEÑOR ayanan."
2,1,"E ora ei Ana a hasi orashon i a bisa: \"Mi kurason ta regosihá den SEÑOR; mi kachu ta halsá den SEÑOR. Mi boka ta papia ku kurashi kontra mi enemigunan, pasobra mi ta alegrá den Bo salbashon."
2,2,"\"No tin ningun santu manera SEÑOR, di bèrdat, no tin ningun otro fuera di Bo, tampoko no tin ningun baranka manera nos Dios."
2,3,"\"No gaba mas ku tantu orguyo, no laga arogansia sali for di bo boka; pasobra SEÑOR ta un Dios di konosementu, i serka djE akshonnan ta wòrdu pisá."
2,4,"\"E bognan di e poderosonan ta kibrá na pida-pida, ma e debilnan ta fahá ku forsa."
2,5,"Esnan ku tabata barika yen ta hür nan mes pa pan, ma esnan ku tabatin hamber no tin hamber mas. Asta esun steril ta duna lus na shete yu, ma esun ku tin hopi yu ta debilitá."
2,6,"\"SEÑOR ta mata i ta duna bida; E ta hasi baha den Seol i ta hasi lanta."
2,7,"SEÑOR ta hasi pober i ta hasi riku; E ta rebahá, tambe E ta halsa."
2,8,"E ta lanta e pober for di den stòf, E ta hisa esun den nesesidat for di e monton di shinishi, pa pone nan sinta huntu ku e nobelnan i eredá un puesto di onor. \"Pasobra e pilarnan di e tera ta di SEÑOR, i El a pone mundu riba nan."
2,9,"E ta warda e pianan di Su santunan, ma e malbadonan ta wòrdu silensiá den skuridat. \"Pasobra no ta pa medio di forsa un hende ta prevalesé."
2,10,"Esnan ku lucha ku SEÑOR lo wòrdu kibrá na pida-pida; kontra nan E lo strena den e shelunan, SEÑOR lo huzga e finnan di tera. I E lo duna forsa na Su rei i lo halsa e kachu di Su ungí.\""
2,11,"E ora ei Elkana a bai su kas na Rama. Ma e mucha hòmber tabata sirbi SEÑOR dilanti di saserdote Elí."
2,12,"Awor e yu hòmbernan di Elí tabata hòmbernan pèrvèrso; nan no tabata konosé SEÑOR,"
2,13,"ni e kustumber di e saserdotenan pa ku e pueblo. Ora ku un hòmber tabata ofresé un sakrifisio, e sirbidó di e saserdote tabata bin ora ku e karni tabata herebé ku un fòrki di tres punta den su man."
2,14,"E ora ei e tabata hinka esaki den e panchi òf ketel òf wea òf paila; tur loke ku e fòrki trese ariba, e saserdote tabata tuma pa su mes. Asina nan tabata hasi na Silo ku tur e israelitanan ku tabata bin ayanan."
2,15,"Tambe, promé ku nan kima e vèt, e sirbidó di e saserdote tabata bin i bisa e hòmber ku tabata ofresé e sakrifisio: \"Duna e saserdote karni pa hasa riba kandela, pasobra e lo no tuma karni herebé for di bo, solamente karni kurú.\""
2,16,"I si e hòmber bis'é: \"Laga nan kima e vèt promé, kaba kohe kuantu ku bo ta deseá,\" e ora ei e tabata bisa: \"Nò, bo mester dunami e karni awor; i si no, lo mi kit'é ku forsa.\""
2,17,"Asina e piká di e hobennan tabata masha grandi mes dilanti di SEÑOR, pasobra e hòmbernan tabata menospresiá e ofrenda di SEÑOR."
2,18,"Awor Samuel tabata sirbi dilanti di SEÑOR--un mucha ku un efòd di lino bistí."
2,19,"I su mama tabata traha un mantel chikitu p'é i tabata trese esaki tur aña p'é ora ku e tabata bin ku su esposo pa ofresé e sakrifisio di tur aña."
2,20,"E ora ei Elí tabata bendishoná Elkana i su esposa, i e tabata bisa: \"Ku SEÑOR dunabo yunan for di e muhé aki na lugá di esun ku el a dediká na SEÑOR.\" I nan a bai nan mes kas."
2,21,"I SEÑOR a bishitá Ana; i el a konsebí i a duna lus na tres yu hòmber i dos yu muhé. I e mucha hòmber Samuel a krese dilanti di SEÑOR."
2,22,"Awor Elí tabata hopi bieu; i el a tende tur loke su yu hòmbernan tabata hasi ku henter Israel, i kon nan tabata drumi ku e muhénan ku tabata sirbi na entrada di e tènt di reunion."
2,23,"I el a bisa nan: \"Pakiko boso ta hasi kosnan asina, e kosnan malu ku mi ta tende di tur e hendenan aki?"
2,24,"Nò, mi yunan; pasobra e notisia ku mi ta tende e pueblo di Dios ta plama tur rònt no ta bon."
2,25,"Si un hende hasi piká kontra un otro, Dios lo intermediá p'é; ma si un hende hasi piká kontra SEÑOR, ken lo intersedé p'é?\" Ma nan no kier a skucha e bos di nan tata, pasobra SEÑOR tabata kier a mata nan."
2,26,"Awor e mucha hòmber Samuel tabata krese den estatura i den grasia, tantu serka SEÑOR komo serka hende."
2,27,"E ora ei un hòmber di Dios a bin serka Elí i a bis'é: \"Asina SEÑOR ta bisa: 'Mi no a revelá Mi mes klaramente na e kas di bo tata, tempu ku nan tabata bou di sklabitut na e kas di Farao na Egipto?"
2,28,"I no ta nan Mi a skohe for di tur e tribunan di Israel pa ta Mi saserdotenan, pa subi na Mi altar, pa kima sensia, pa bisti efòd Mi dilanti? I no ta e kas di bo tata Mi a duna tur e ofrendanan di kandela di e yunan di Israel?"
2,29,"Pakiko bo ta despresiá Mi sakrifisio i Mi ofrenda ku Mi a ordená den Mi lugá di biba, i ta onra bo yu hòmbernan mas ku Mi, dor di hasi boso mes gordo ku e mihó di tur ofrenda di Mi pueblo Israel?'"
2,30,"\"Pesei e SEÑOR Dios di Israel ta deklará: 'Di bèrdat, Mi a bisa ku bo kas i e kas di bo tata lo kana Mi dilanti pa semper'; ma awor SEÑOR ta deklará: 'Ku esei sea leu di Mi, pasobra esnan ku onraMi, lo Mi onra, i esnan ku despresiáMi, lo ta poko apresiá."
2,31,"Mira, e dianan ta bin ku lo Mi kibra bo forsa i forsa di e kas di bo tata, asina ku nunka lo no tin un hòmber bieu den bo kas."
2,32,"I lo bo mira e aflikshon di Mi lugá di biba, apesar di tur e bon ku Mi ta hasi pa Israel; i nunka mas lo no tin un hòmber bieu den bo kas."
2,33,"Sinembargo, lo Mi no kita tur bo hòmbernan for di Mi altar, pa bo wowonan faya di yoramentu i bo alma keda tristu, i tur desendiente di bo kas muri den e flor di nan hubentut."
2,34,"'I esaki lo ta e señal pa bo tokante di loke ta bai sosodé ku bo dos yu hòmbernan, Ofni i Finees: nan tur dos lo muri riba e mesun dia."
2,35,"Ma lo Mi lanta pa Mi mes un saserdote fiel, kende lo hasi segun loke ta den Mi kurason i den Mi alma; i lo Mi traha p'é un kas duradero, i e lo kana dilanti di Mi ungí pa semper."
2,36,"I lo sosodé ku kada un ku keda den bo kas lo bin i bùig p'é pa un pida plata òf un pan, i lo bisa: \"Pa fabor, ponemi den un di e sirbishinan saserdotal, pa mi por kome pida pan.\"'\""
3,1,"Awor e mucha hòmber Samuel tabata ministrá na SEÑOR dilanti di Elí. I palabra ku tabata bin di SEÑOR tabata skars den e dianan ei, i vishonnan tabata masha poko."
3,2,"I a sosodé den e tempu ei ora ku Elí tabata drumí na su lugá (awor su bista a kuminsá bira skur i e no por a mira bon),"
3,3,"i e lampi di Dios no a paga ainda, i Samuel tabata drumí den e tèmpel di SEÑOR kaminda e arka di Dios tabata,"
3,4,"ku SEÑOR a yama Samuel. I el a kontestá: \"At'ami aki.\""
3,5,"Anto el a kore bai serka Elí i a bisa: \"At'ami aki, pasobra bo a yamami.\" Ma Elí a kontestá: \"Mi no a yama, bai drumi atrobe.\" Asina el a bai i a kai drumi."
3,6,"I SEÑOR a bolbe yama: \"Samuel!\" Asina Samuel a lanta i a bai serka Elí i a bisa: \"At'ami aki, pasobra bo a yamami.\" Ma Elí a bisa: \"Mi no a yama, mi yu, bai drumi atrobe.\""
3,7,"Awor Samuel no tabata konosé SEÑOR ainda, ni e palabra di SEÑOR no a wòrdu revelá na djé ainda."
3,8,"Asina SEÑOR a bolbe yama Samuel pa di tres biaha. I el a lanta i a bai serka Elí i a bisa: \"At'ami aki, pasobra bo a yamami.\" E ora ei Elí a komprendé ku ta SEÑOR tabata yama e mucha hòmber."
3,9,"I Elí a bisa Samuel: \"Bai drumi, i si E yamabo, bo mester bisa: 'Papia SEÑOR, pasobra Bo sirbidó ta skuchando.'\" Asina Samuel a bai i a kai drumi na su lugá."
3,10,"Anto SEÑOR a bin para i a yama manera e otro biahanan: \"Samuel! Samuel!\" I Samuel a bisa: \"Papia, pasobra Bo sirbidó ta skuchando.\""
3,11,"I SEÑOR a bisa Samuel: \"Mira, Mi ta bai hasi un kos den Israel ku lo hasi tur dos orea di tur esnan ku tende esaki flùit."
3,12,"Riba e dia ei lo Mi kumpli kontra Elí tur loke Mi a papia tokante di su kas, for di kuminsamentu te na fin."
3,13,"Pasobra Mi a bis'é ku Mi ta bai huzga su kas pa semper, pa e inikidat ku e tabata sa di djé, pasobra su yu hòmbernan a trese un maldishon riba nan mes i e no a reprendé nan."
3,14,"I pesei Mi a hura na e kas di Elí ku e inikidat di e kas di Elí lo no wòrdu ekspiá nunka, ni pa medio di sakrifisio ni pa medio di ofrenda.\""
3,15,"Asina Samuel a bai drumi te mainta. Anto el a habri e portanan di e kas di SEÑOR. Ma Samuel tabatin miedu di konta Elí e vishon."
3,16,"Anto Elí a yama Samuel i a bisa: \"Samuel, mi yu.\" I Samuel a bisa: \"At'ami aki.\""
3,17,"I Elí a bisa: \"Kiko ta e palabra ku El a papia ku bo? Pa fabor, no skonde esaki pa mi. Ku Dios hasi asina ku bo, i pió ainda, si bo skonde kualke kos pa mi di tur e palabranan ku El a papia ku bo.\""
3,18,"Asina Samuel a kont'é tur kos i no a skonde nada p'é. I Elí a bisa: \"Ta SEÑOR; lagu'E hasi loke ta pars'E bon.\""
3,19,"Asina Samuel a krese i SEÑOR tabata kuné i no a laga ningun di su palabranan faya."
3,20,"I henter Israel, for di Dan te na Beerseba, tabata sa ku Samuel a wòrdu konfirmá komo un profeta di SEÑOR."
3,21,"I SEÑOR a bolbe paresé na Silo, pasobra SEÑOR a revelá Su Mes na Samuel na Silo pa medio di e palabra di SEÑOR."
4,1,"Asina e palabra di Samuel a yega na henter Israel. Awor Israel a sali bai pa kontra ku e filisteonan den bataya i a kampa banda di Eben-ezer, mientras ku e filisteonan a kampa na Afek."
4,2,"I e filisteonan a pone nan mes den òrdu di bataya pa kontra ku Israel. Ora ku e bataya a plama bira mas grandi, Israel a wòrdu derotá dilanti di e filisteonan, kendenan a mata mas o menos kuater mil hòmber riba e tereno di bataya."
4,3,"Ora ku e pueblo a bin den e kampamentu, e ansianonan di Israel a bisa: \"Pakiko SEÑOR a derotá nos awe dilanti di e filisteonan? Laga nos trese pa nos mes for di Silo e arka di e aliansa di SEÑOR, pa e bin meimei di nos i libra nos di e poder di nos enemigunan.\""
4,4,"Asina e pueblo a manda mensahe na Silo, i for di aya nan a trese e arka di e aliansa di e SEÑOR di ehérsitonan, Kende ta sinta ariba di e kerubinnan; i e dos yu hòmbernan di Elí, Ofni i Finees, tabata ayanan ku e arka di aliansa di Dios."
4,5,"I a sosodé ku ora e arka di e aliansa di SEÑOR a bin den e kampamentu, henter Israel a dal un gritu duru, asina ku tera a tembla."
4,6,"I ora ku e filisteonan a tende e zonidu di e gritu, nan a bisa: \"Ta kiko e zonidu di e gritu duru aki den e kampamentu di e hebreonan ta nifiká?\" E ora ei nan a komprendé ku e arka di SEÑOR a yega den e kampamentu."
4,7,"I e filisteonan a haña miedu, pasobra nan a bisa: \"Dios a bin den e kampamentu.\" I nan a bisa: \"Ai di nos! Pasobra nunka antes un kos asin'aki no a yega di sosodé."
4,8,"Ai di nos! Ken lo libra nos for di man di e diosnan poderoso aki? Esakinan ta e diosnan ku a suta e egipsionan ku tur sorto di plaga den desierto."
4,9,"Tuma kurashi i sea hòmber, O filisteonan, pa boso no bira esklabu di e hebreonan, manera nan tabata boso esklabu; pesei, sea hòmber i bringa.\""
4,10,"Asina e filisteonan a bringa, i Israel a wòrdu derotá, i kada hòmber a hui bai na su tènt i e matansa tabata masha grandi mes; pasobra di Israel a kai trinta mil sòldá-na-pia."
4,11,"I nan a kohe e arka di Dios; i e dos yu hòmbernan di Elí, Ofni i Finees, a muri."
4,12,"Awor riba e mesun dia ei un hòmber di Benjamin a kore for di e fila di bataya bai Silo, ku su pañanan gesker i ku tera riba su kabes."
4,13,"Ora ku el a yega, ata, Elí tabata sintá riba su asiento banda di kaminda, sperando ansiosamente, pasobra su kurason tabata tembla pa kousa di e arka di Dios. Ora ku e hòmber a drenta den e stat i a konta loke a pasa, henter e stat a dal un gritu."
4,14,"Ora ku Elí a tende e zonidu di e gritamentu, el a bisa: \"Ta kiko e boroto aki ta nifiká?\" Anto e hòmber a bin purá-purá i a konta Elí."
4,15,"Awor Elí tabatin nobent'i ocho aña i su wowo a bira skur, asina ku e no por a mira."
4,16,"I e hòmber a bisa Elí: \"Ami ta esun ku a bin for di e fila di bataya. Di bèrdat, awe mi a hui for di e fila di bataya.\" I Elí a bisa: \"Kon kos a bai, mi yu?\""
4,17,"E ora ei esun ku a trese e notisia a kontestá i a bisa: \"Israel a hui dilanti di e filisteonan i tabatin tambe un gran matansa meimei di e pueblo, i tambe bo dos yu hòmbernan, Ofni i Finees, a muri, i e arka di Dios a wòrdu kapturá.\""
4,18,"I a sosodé ku ora el a menshoná e arka di Dios, Elí a kai ku lomba for di su asiento banda di e porta di stat, i a kibra su nèk i el a muri, pasobra e tabata bieu i pisá. Asina Elí a huzga Israel kuarenta aña."
4,19,"Awor su nuera, esposa di Finees, tabata na estado i serka di duna lus; i ora ku el a tende e notisia ku nan a kohe e arka di Dios i ku su suegro i su esposo a muri, el a sak abou i a duna lus, pasobra su dolónan di parto a lanta."
4,20,"I ora ku e tabata muriendo e muhénan ku tabata pará banda di djé a bis'é: \"No tene miedu, pasobra bo a duna lus na un yu hòmber.\" Ma e no a kontestá ni a pone atenshon."
4,21,"I el a yama e mucha Ikabod, bisando: \"E gloria a bai for di Israel,\" pasobra nan a kohe e arka di Dios i pa motibu di su suegro i su esposo."
4,22,"I el a bisa: \"E gloria a bai for di Israel, pasobra nan a kohe e arka di Dios.\""
5,1,"Awor e filisteonan a kohe e arka di Dios i a hib'é for di Eben-ezer na Asdod."
5,2,"Anto e filisteonan a kohe e arka di Dios i a hib'é na e kas di Dagon i a pon'é banda di Dagon."
5,3,"Su manisé, ora ku e asdoditanan a lanta mainta tempran, ata Dagon tabata bentá abou riba su kara dilanti di e arka di SEÑOR. Asina nan a kohe Dagon i a bolbe pon'é na su lugá."
5,4,"Ma su manisé, ora nan a lanta mainta tempran, ata Dagon tabata bentá abou riba su kara dilanti di e arka di SEÑOR. I Dagon su kabes i su dos plant'i mannan a wòrdu kòrtá afó riba e drèmpel; solamente Dagon su kurpa a keda."
5,5,"Pesei ni e saserdotenan di Dagon, ni ningun hende ku drenta den e kas di Dagon na Asdod, no ta pone pia riba e drèmpel di Dagon na Asdod te dia djawe."
5,6,"Awor e man di SEÑOR tabata pisá riba e asdoditanan i El a destrosá nan i a afligí nan ku tumor, tantu Asdod komo su teritorionan."
5,7,"Ora ku e hòmbernan di Asdod a mira ku tabata asina, nan a bisa: \"E arka di e Dios di Israel no mester keda serka nos, pasobra Su man ta duru riba nos i riba Dagon nos dios.\""
5,8,"Asina nan a manda yama i a reuní tur e prensnan di e filisteonan huntu i a bisa: \"Kiko nos mester hasi ku e arka di e Dios di Israel?\" I nan a bisa: \"Laga e arka di e Dios di Israel wòrdu hibá bèk na Gat.\" I nan a hiba e arka di e Dios di Israel ayanan."
5,9,"I a sosodé ku despues ku nan a hib'é bèk, e man di SEÑOR tabata kontra e stat ku un konfushon masha grandi mes; i El a afligí e hòmbernan di e stat, tantu hoben komo bieu, asina ku nan kurpa a yena ku tumor."
5,10,"Asina nan a manda e arka di Dios na Ekron. I a sosodé ku ora e arka di Dios a yega Ekron, e ekronitanan a sklama, bisando: \"Nan a trese e arka di e Dios di Israel aki bèk serka nos pa mata nos i nos pueblo.\""
5,11,"Pesei nan a manda yama i a reuní tur e prensnan di e filisteonan i a bisa: \"Manda e arka di e Dios di Israel bai, i lagu'é bolbe na su mes lugá, pa e no mata nos i nos pueblo.\" Pasobra den henter e stat tabatin un konfushon mortal; e man di Dios tabata masha pisá ayanan."
5,12,"I e hòmbernan ku no a muri a wòrdu afligí ku tumor, i e sklamashon di e stat a subi te na shelu."
6,1,"Awor e arka di SEÑOR tabata den e tera di e filisteonan pa shete luna."
6,2,"I e filisteonan a manda yama e saserdotenan i e adivinadónan, bisando: \"Kiko nos mester hasi ku e arka di SEÑOR? Bisa nos kon nos mester mand'é su lugá bèk.\""
6,3,"I nan a bisa: \"Si boso debolbé e arka di e Dios di Israel, no mand'é bashí; ma siguramente boso mester manda un ofrenda pa kulpa p'E. E ora ei boso lo kura i boso lo haña sa ta pakiko Su man no a kita for di boso.\""
6,4,"E ora ei nan a bisa: \"Ki ofrenda pa kulpa nos mester manda p'E?\" I nan a bisa: \"Sinku tumor di oro i sinku raton di oro, segun e kantidat di e prensnan di e filisteonan, pasobra e mesun plaga tabatin riba boso tur i riba boso prensnan."
6,5,"Asina boso mester traha modelo di boso tumornan i modelo di boso ratonnan ku ta destruí e tera, i boso mester duna gloria na e Dios di Israel; podisé E lo slèk Su man for di riba boso, boso diosnan i boso tera."
6,6,"Pakiko anto boso ta hasi boso kurason duru, manera e egipsionan i Farao a hasi nan kurason duru? Ora ku El a trata duru ku nan, no t'asina ku nan a pèrmití e pueblo bai, i nan a bai?"
6,7,"\"Pesei anto, kohe i prepará un garoshi nobo i dos baka di lechi ku no a karga yugo nunka ainda; i gancha e bakanan na e garoshi i kita nan bishénan for di nan hiba kas."
6,8,"I kohe e arka di SEÑOR i pon'é riba e garoshi; i pone e artíkulonan di oro ku boso ta manda p'E komo un ofrenda pa kulpa den un kaha banda di djé. Anto mand'é bai; lagu'é bai."
6,9,"I wak, si e subi pa e kaminda di su mes teritorio bai Bèt-semes, anto ta E a hasi nos e maldat grandi aki. Ma si no, e ora ei nos lo sa ku no ta Su man a afligí nos; ta pa kasualidat esaki a sosodé ku nos.\""
6,10,"Anto e hòmbernan a hasi asina, i a kohe dos baka di lechi i a gancha nan na e garoshi i a sera nan bishénan na kas."
6,11,"I nan a pone e arka di SEÑOR riba e garoshi, i tambe e kaha ku e ratonnan di oro i e modelonan di nan tumornan."
6,12,"I e bakanan a kohe e kaminda direkto den direkshon di Bèt-semes; nan a pasa riba e kaminda grandi, i tabata grita segun ku nan tabata bai, i nan no a bira bai ni na man drechi ni na man robes. I e prensnan di e filisteonan a sigui nan te na e frontera di Bèt-semes."
6,13,"Awor e hendenan di Bèt-semes tabata kosechá nan trigo den e vaye, i nan a hisa kara mira e arka i a bira kontentu di mir'é."
6,14,"I e garoshi a yega den e kunuku di Josué e bèt-semita, i a keda para einan kaminda tabatin un piedra grandi; i nan a spleit e palu di e garoshi i a ofresé e bakanan komo un ofrenda kimá na SEÑOR."
6,15,"I e levitanan a baha e arka di SEÑOR i e kaha ku tabata huntu kuné, ku tabata kontené e artíkulonan di oro, i a pone nan riba e piedra grandi; i e hòmbernan di Bèt-semes a ofresé ofrendanan kimá i a ofresé sakrifisionan na SEÑOR e dia ei."
6,16,"I ora ku e sinku prensnan di e filisteonan a mira esaki, nan a bolbe Ekron e mesun dia."
6,17,"I esakinan ta e tumornan di oro ku e filisteonan a debolbé komo un ofrenda pa kulpa na SEÑOR: un pa Asdod, un pa Gaza, un pa Askalon, un pa Gat, un pa Ekron;"
6,18,"i e ratonnan di oro, segun e kantidat di tur e statnan di e filisteonan ku tabata pertenesé na e sinku prensnan, tantu di e statnan fortifiká komo di e pueblitonan di kunuku. E piedra grandi ku nan a pone e arka di SEÑOR ariba ta un testimonio te dia djawe den e kunuku di Josué e bèt-semita."
6,19,"I El a mata algun di e hòmbernan di Bèt-semes, pasobra nan a wak den e arka di SEÑOR. El a mata di henter e pueblo sinkuenta mil i setenta hòmber, i e pueblo a lamentá, pasobra SEÑOR a dal e pueblo ku un gran matansa."
6,20,"I e hòmbernan di Bèt-semes a bisa: \"Ken por para dilanti di SEÑOR, e Dios santu aki? I serka ken lo E bai despues di nos?\""
6,21,"Asina nan a manda mensaheronan serka e habitantenan di Kiriat-jearim, bisando: \"E filisteonan a debolbé e arka di SEÑOR; baha bin koh'é hiba serka boso.\""
7,1,"I e hòmbernan di Kiriat-jearim a bin i a kohe e arka di SEÑOR i a hib'é den e kas di Abinadab riba seru, i a konsagrá su yu hòmber Eleazar pa kuida e arka di SEÑOR."
7,2,"I a sosodé ku for di e dia ku e arka a keda na Kiriat-jearim a pasa basta tempu, pasobra tabata binti aña na tur; i henter e kas di Israel a lamentá i a buska SEÑOR."
7,3,"E ora ei Samuel a papia ku henter e kas di Israel, bisando: \"Si boso bolbe serka SEÑOR ku henter boso kurason, kita e diosnan stranhero i e Astarot for di meimei di boso i dirigí boso kurason na SEÑOR i sirbi E so, E lo libra boso for di man di e filisteonan.\""
7,4,"Asina e yunan di Israel a kita e Baalnan i e Astarot i a sirbi SEÑOR so."
7,5,"E ora ei Samuel a bisa: \"Reuní henter Israel na Mizpa i lo mi hasi orashon na SEÑOR pa boso.\""
7,6,"I nan a reuní na Mizpa i a saka awa i a bash'é dilanti di SEÑOR, i a yuna riba e dia ei i a bisa ayanan: \"Nos a peka kontra SEÑOR.\" I Samuel a huzga e yunan di Israel na Mizpa."
7,7,"Awor ora ku e filisteonan a tende ku e yunan di Israel a reuní na Mizpa, e prensnan di e filisteonan a bai kontra Israel. I ora ku e yunan di Israel a tende esaki, nan a haña miedu di e filisteonan."
7,8,"E ora ei e yunan di Israel a bisa Samuel: \"No stòp di sklama na SEÑOR nos Dios pa nos, pa E salba nos for di man di e filisteonan.\""
7,9,"I Samuel a kohe un lamchi na lechi i a ofresé esaki henté komo un ofrenda kimá na SEÑOR; i Samuel a sklama na SEÑOR pa Israel, i SEÑOR a kontest'é."
7,10,"Mientras ku Samuel tabata ofresé e ofrenda kimá, e filisteonan a hala serka pa bringa kontra Israel. Ma SEÑOR a strena ku un strena duru kontra e filisteonan riba e dia ei i a konfundí nan, asina ku nan a keda derotá dilanti di Israel."
7,11,"I e hòmbernan di Israel a sali for di Mizpa, a pèrsiguí e filisteonan i a derotá nan te bou di Bèt-kar."
7,12,"E ora ei Samuel a kohe un piedra i a pon'é meimei di Mizpa i Sen, i a yam'é Eben-ezer, bisando: \"Te akinan SEÑOR a yuda nos.\""
7,13,"Asina e filisteonan a wòrdu sometí i nan no a pasa e frontera di Israel mas. I e man di SEÑOR tabata kontra e filisteonan tur e dianan di Samuel."
7,14,"I e statnan ku e filisteonan a kohe for di Israel a wòrdu debolbí na Israel, for di Ekron te na Gat; i Israel a libra nan teritorio for di man di e filisteonan. Asina tabatin pas entre Israel i e amoreonan."
7,15,"Awor Samuel a huzga Israel tur e dianan di su bida."
