chapter,verse,"text"
15,21,"I nan a obligá un hende, ku tabata pasa, pa karga Su krus, un tal Simon di Sirene, kende tabata bin for di kunuku, tata di Alehandro i Rufus."
15,22,"I nan a hib'E na e lugá ku yama Gólgota, ku tradusí ta nifiká Lugá di Kalpachi."
15,23,"I nan a dun'E biña mesklá ku mirra, ma E no a tum'é."
15,24,"I nan a krusifik'E i a parti Su pañanan entre nan dor di tira lòt riba nan, pa disidí kiko kada un lo a haña."
15,25,"I tabata nueb'or di mainta ora nan a krusifik'E."
15,26,"I e inskripshon di e akusashon kontra djE tabata bisa: \"E REI DI E HUDIUNAN.\""
15,27,"I nan a krusifiká dos ladron huntu kunE, un na Su man drechi i un na Su man robes."
15,28,"[I e Skritura a keda kumplí ku ta bisa: \"I El a wòrdu kontá ku e transgresornan.\"f28*"
15,29,"I esnan ku tabata pasa tabata blasfem'E i sakudí kabes, bisando: \"Ahan! Abo ku ta bai destruí e tèmpel i lant'é bèk den tres dia,"
15,30,"salba Bo mes, i baha for di e krus ei!\""
15,31,"Di e mesun manera e saserdotenan prinsipal tambe, huntu ku e eskribanan, tabata hasi bofon di djE i tabata bisa otro: \"El a salba otronan; E no por salba Su mes."
15,32,"Laga e Cristo aki, e Rei di Israel, baha for di e krus awor, pa nos por mira i kere!\" I esnan ku a wòrdu krusifiká huntu kunE tabata tira e mesun insulto na Su kara."
15,33,"I ora ku a bira diesdos or, skuridat a baha riba henter e tera te tres or di atardi."
15,34,"I pa tres or di atardi Jesus a sklama na bos haltu: \"|iEloi, Eloi, lama sabaktani?\" ku tradusí ta nifiká: \"Mi Dios, Mi Dios, pakiko Bo a bandonáMi?\""
15,35,"I ora ku algun hende ku tabata pará einan a tende esei, nan a bisa: \"Mira, ta Elias E ta yama.\""
15,36,"I un hende a kore bin i a papa un spòns ku binager, a hink'é na un richi i a dun'E di bebe, bisando: \"Laga nos wak si Elias ta bin bah'E.\""
15,37,"I Jesus a dal un gritu duru, i a hala Su último rosea."
15,38,"I e kortina di tèmpel a sker na dos, for di ariba te abou."
15,39,"I ora ku e senturión ku tabata pará nèt Su dilanti a mira kon El a hala Su último rosea, el a bisa: \"Di bèrdat e hòmber aki tabata e Yu di Dios!\""
15,40,"I tambe tabatin algun hende muhé ta para wak for di un distansia, entre nan Maria Magdalena, Maria, mama di Santiago Chikí i di Jose, i Salomé."
15,41,"I tempu ku E tabata na Galilea, nan tabata siguiE i sirbiE; i tabatin hopi otro hende muhé ku a bin Jerusalèm huntu kunE."
15,42,"I ora ku a bira tardi kaba, pasobra tabata dia di preparashon, esta, bispu di Sabat,"
15,43,"Jose di Arimatea, un miembro prominente di Konsilio, kende tambe tabata spera e reino di Dios, a bin i el a tuma kurashi i a drenta bai serka Pilato, i a pidi e kurpa di Jesus."
15,44,"I Pilato a haña straño ku ya El a muri kaba, i a manda yama e senturión i a puntr'é si El a muri kaba."
15,45,"I ora ku el a haña sa esaki for di e senturión, el a entregá e kurpa na Jose."
15,46,"I Jose a kumpra tela di lino, a bah'E for di krus, a lor'E den e tela di lino i a pon'E den un tumba ku a wòrdu kobá den baranka; i el a lora un piedra pone na entrada di e tumba."
15,47,"I Maria Magdalena i Maria, mama di Jose, tabata wak pa mira na unda El a wòrdu poní."
16,1,"I ora Sabat a pasa, Maria Magdalena i Maria, mama di Santiago, i Salomé, a kumpra speserei pa nan bai ungiE."
16,2,"I mainta bon tempran, riba e promé dia di siman, ora solo a sali, nan a bin na e tumba."
16,3,"I nan tabata bisa otro: \"Ken lo lora e piedra kit'é for di entrada di e tumba pa nos?\""
16,4,"I ora nan a hisa kara wak, nan a mira ku e piedra a wòrdu kitá, apesar ku e tabata masha grandi mes."
16,5,"I ora nan a bai den e tumba, nan a mira un hoben, bistí na paña blanku largu, sintá na banda drechi, i nan a keda masha asombrá."
16,6,"I el a bisa nan: \"No tene miedu. Boso ta buska Jesus di Nazarèt, Kende a wòrdu krusifiká. El a resusitá; E no t'aki; mira e lugá kaminda nan a pon'E."
16,7,"Ma bai, bisa Su disipelnan i Pedro: 'E ta bai Galilea boso dilanti; ayanan boso lo mir'E, manera El a bisa boso.'\""
16,8,"I nan a sali pafó i a hui bai for di e tumba, pasobra nan tabata tembla i tabata tur asombrá; i nan no a bisa ningun hende nada, pasobra nan tabatin miedu."
16,9,"[Awor despues ku El a lanta mainta tempran riba e promé dia di siman, El a paresé promé na Maria Magdalena, for di kende El a saka shete demoño."
16,10,"El a bai i a hiba e notisia pa esnan ku tabata huntu kunE, i kendenan tabata lamentá i yora."
16,11,"I ora nan a tende ku E tabata bibu i ku Maria Magdalena a mir'E, nan no kier a kere."
16,12,"I despues El a paresé den un otro figura na dos di nan, ora ku, na pia, nan tabata na kaminda pa kunuku."
16,13,"I nan a bai i a hiba e notisia pa e otronan, ma esakinan tampoko no a kere nan."
16,14,"I despues El a paresé na e diesunnan mes, ora nan tabata sintá na mesa, i El a reprendé nan inkredulidat i duresa di kurason, pasobra nan no a kere esnan ku a mir'E despues ku El a wòrdu lantá."
16,15,"I El a bisa nan: \"Bai den henter mundu i prediká e evangelio na tur kriatura."
16,16,"Esun ku a kere i a wòrdu batisá lo ta salbá; ma esun ku no a kere lo ta kondená."
16,17,"I e señalnan aki lo kompañá esnan ku kere: den Mi nòmber nan lo saka demoño, nan lo papia den lenga nobo;"
16,18,"nan lo kohe kolebra ku man, i si nan bebe kualkier veneno mortal, esei lo no hasi nan daño; nan lo pone man riba hende malu i esakinan lo bira bon.\""
16,19,"Asina anto, ora Señor Jesus a kaba di papia ku nan, El a wòrdu risibí ariba den shelu, i a sinta na man drechi di Dios."
16,20,"I nan a sali bai i a prediká tur kaminda, i Señor tabata traha huntu ku nan, i tabata konfirmá e palabra pa medio di e señalnan ku tabata sigui. Amèn.]"
